{
  "$schema": "./briefing_schedule.schema.json",
  "version": "1.0.0",
  "description": "Configuration for automated daily briefing scheduling",

  "briefings": {
    "morning": {
      "enabled": true,
      "time": "07:00",
      "timezone": "local",
      "days": {
        "monday": true,
        "tuesday": true,
        "wednesday": true,
        "thursday": true,
        "friday": true,
        "saturday": true,
        "sunday": true
      },
      "template": "briefing_morning.md",
      "delivery_channels": ["cli", "file"]
    },
    "evening": {
      "enabled": false,
      "time": "19:00",
      "timezone": "local",
      "days": {
        "monday": true,
        "tuesday": true,
        "wednesday": true,
        "thursday": true,
        "friday": true,
        "saturday": false,
        "sunday": true
      },
      "template": "briefing_evening.md",
      "delivery_channels": ["cli", "file"]
    }
  },

  "delivery": {
    "cli": {
      "enabled": true,
      "color": true
    },
    "file": {
      "enabled": true,
      "output_dir": "History/DailyBriefings",
      "filename_pattern": "{date}_{type}_briefing.md"
    },
    "notification": {
      "enabled": false,
      "summary_only": true
    },
    "email": {
      "enabled": false,
      "smtp_server": "smtp.gmail.com",
      "smtp_port": 587,
      "use_tls": true,
      "from_address": "",
      "to_address": "",
      "subject_pattern": "{type} Briefing - {date}",
      "format": "html",
      "service": "smtp",
      "_comment": "Email delivery is not yet implemented. This is a placeholder for future integration with SMTP or email service APIs (SendGrid, Mailgun, AWS SES)."
    }
  },

  "content": {
    "max_priorities": 3,
    "include_quick_wins": true,
    "include_calendar": true,
    "include_energy_prompts": false,
    "weekend_mode": {
      "enabled": true,
      "exclude_work_tasks": true,
      "focus_on_personal": true
    }
  },

  "scheduler": {
    "check_interval_minutes": 1,
    "prevent_duplicate_runs": true,
    "log_file": "logs/briefing_scheduler.log",
    "error_notification": true
  },

  "advanced": {
    "state_dir": "State",
    "templates_dir": "Templates",
    "use_llm_enhancement": false,
    "llm_model": "gpt-4o-mini",
    "pattern_learning_enabled": false
  }
}
